{
  "schemaVersion": "1.0",
  "eventType": "file.transfer.requested",
  "eventId": "1b2c3d4e-5f60-4718-9a2b-3c4d5e6f7081",
  "correlationId": "3fa85f64-5717-4562-b3fc-2c963f66afa6",
  "idempotencyKey": "sha256:9f86d081884c7d659a2feaa0c55ad015a3bf4f1b2b0b822cd15d6c15b0f00a08",
  "occurredAt": "2026-06-10T09:32:11Z",
  "source": {
    "provider": "sftp",
    "path": "/watch/orders/ORD-20260610-0001.csv"
  },
  "file": {
    "name": "ORD-20260610-0001.csv",
    "sizeBytes": 4096,
    "checksumSha256": "9f86d081884c7d659a2feaa0c55ad015a3bf4f1b2b0b822cd15d6c15b0f00a08",
    "contentType": "text/csv"
  },
  "destinations": [
    {
      "provider": "aws-s3",
      "bucket": "wms-orders-processed",
      "key": "orders/ORD-20260610-0001.csv",
      "region": "us-east-1"
    },
    {
      "provider": "gcp-gcs",
      "bucket": "wms-orders-processed",
      "key": "orders/ORD-20260610-0001.csv"
    }
  ],
  "retry": {
    "attempt": 2,
    "maxAttempts": 5,
    "lastError": "gcp-gcs:upload_timeout"
  }
}
